name,author,narrator,runtime,release_date,language,stars,price,category,subcategory
Project Maven,Katrina Manson,Katrina Manson,13 hrs and 30 mins,03-24-26,English,Not rated yet,20.99,Computers & Technology,Computer Science
YouTube AI Evolution,Liam Turner,Patrick Shannon,3 hrs and 33 mins,03-13-26,English,5.0    24 ratings,14.67,Computers & Technology,Computer Science
From Zero to AI Trader,Samuel Thorpe,Tom Brooks,5 hrs and 8 mins,03-23-26,English,5.0    7 ratings,19.95,Computers & Technology,Computer Science
We Are as Gods,"Peter H. Diamandis, Steven Kotler",Zac Aleman,9 hrs,04-14-26,English,Not rated yet,19.49,Computers & Technology,Computer Science
Ecommerce in the AI Era,Evan Crossfield,Millian Quinteros,3 hrs and 53 mins,03-09-26,English,5.0    25 ratings,14.67,Computers & Technology,Computer Science
Building AI Chatbots,Barrett Williams,Virtual Voice,5 hrs and 6 mins,03-23-26,English,4.0    1 rating,Free,Computers & Technology,Computer Science
AI ChatGPT Prompt Engineering Secrets,Maxwell Cyberstein,Millian Quintero,2 hrs and 3 mins,06-09-25,English,5.0    10 ratings,13.20,Computers & Technology,Computer Science
The AI-Driven Leader,Geoff Woods,Geoff Woods,6 hrs and 39 mins,09-16-24,English,4.5    481 ratings,17.58,Computers & Technology,Computer Science
Book 1: Social Media Marketing for Beginners 2026,Maxwell Cyberstein,Millian Quintero,3 hrs and 17 mins,09-25-25,English,4.9    8 ratings,14.67,Computers & Technology,Computer Science
ChatGPT for Work Beginners,Angel Talamantes,Jacob Baird,3 hrs and 42 mins,03-17-26,English,5.0    15 ratings,14.95,Computers & Technology,Computer Science
Book 2: Digital Marketing for Beginners 2026,Maxwell Cyberstein,Millian Quintero,3 hrs and 33 mins,09-26-25,English,5.0    8 ratings,14.67,Computers & Technology,Computer Science
AI ChatGPT: Creativity & Productivity Accelerator,Maxwell Cyberstein,Millian Quintero,2 hrs and 30 mins,06-30-25,English,5.0    2 ratings,13.20,Computers & Technology,Computer Science
AI ChatGPT Business Domination,Maxwell Cyberstein,Millian Quintero,6 hrs and 42 mins,07-02-25,English,5.0    13 ratings,17.58,Computers & Technology,Computer Science
AI ChatGPT Automation Money Machine,Maxwell Cyberstein,Millian Quintero,2 hrs and 8 mins,06-20-25,English,5.0    6 ratings,13.20,Computers & Technology,Computer Science
A Cowboy's Guide to Adopt an OpenClaw AI Agent in Your Garage,Marcus Eigh,Virtual Voice,2 hrs and 13 mins,03-23-26,English,Not rated yet,Free,Computers & Technology,Computer Science
Artificial Intelligence Bible (3-in-1),AI Labs Institute,Rory Young,11 hrs and 48 mins,07-28-25,English,4.7    86 ratings,21.48,Computers & Technology,Computer Science
OpenClaw AI Assistant for Beginners,Ryan Foster,Douglas Birk's voice replica,3 hrs and 28 mins,03-11-26,English,Not rated yet,Free,Computers & Technology,Computer Science
CHATGPT SIDE HUSTLES 2025,Maxwell Cyberstein,Millian Quintero,4 hrs and 4 mins,08-11-25,English,5.0    12 ratings,15.34,Computers & Technology,Computer Science
AI Agents,J Cook,Virtual Voice,1 hr and 32 mins,03-21-26,English,Not rated yet,Free,Computers & Technology,Computer Science
Creativity in the Age of AI,"Jerry Wind, Mukul Pandya - contributor, Deborah Yao - contributor","Bob Souer, Nan McNamara",10 hrs and 29 mins,12-30-25,English,5.0    34 ratings,20.56,Computers & Technology,Computer Science
You Are Not Your Brain,Stephen Hawley Martin,Virtual Voice,5 hrs and 4 mins,03-20-26,English,Not rated yet,Free,Computers & Technology,Computer Science
The Coming Wave,"Mustafa Suleyman, Michael Bhaskar",Mustafa Suleyman,12 hrs and 7 mins,09-05-23,English,"4.3    1,261 ratings",20.25,Computers & Technology,Computer Science
Level 7 Leadership,Jack Swift,Jack C. Swift,5 hrs and 31 mins,03-13-26,English,Not rated yet,16.51,Computers & Technology,Computer Science
Paddle Forward,"Pat Bodin, Robert Schaffner, Louis Bodin",Jonathan Yen,9 hrs and 21 mins,03-13-26,English,Not rated yet,20.88,Computers & Technology,Computer Science
Empire of AI,Karen Hao,Karen Hao,17 hrs and 50 mins,05-20-25,English,4.2    633 ratings,24.30,Computers & Technology,Computer Science
The Eye of the Master,Matteo Pasquinelli,Dennis Kleinman,8 hrs and 34 mins,03-18-26,English,Not rated yet,19.52,Computers & Technology,Computer Science
AI Income Generator,Samuel Thorpe,Tom Brooks,3 hrs and 6 mins,03-12-26,English,5.0    34 ratings,14.67,Computers & Technology,Computer Science
"If Anyone Builds It, Everyone Dies","Eliezer Yudkowsky, Nate Soares",Rafe Beckley,6 hrs and 19 mins,09-16-25,English,4.6    863 ratings,22.49,Computers & Technology,Computer Science
AI Trading Systems for Stocks,Angel Talamantes,Jacob Baird,3 hrs and 46 mins,03-13-26,English,5.0    6 ratings,14.28,Computers & Technology,Computer Science
Social Media Marketing for Beginners 2025,Maxwell Cyberstein,"Jason Belvill, Millian",5 hrs and 25 mins,04-24-25,English,4.7    9 ratings,16.87,Computers & Technology,Computer Science
The Singularity Is Nearer,Ray Kurzweil,Adam Barr,10 hrs and 25 mins,06-25-24,English,4.4    686 ratings,20.25,Computers & Technology,Computer Science
Social Media Marketing for Beginners 2025,Evan Crossfield,Millian Quinteros,3 hrs and 2 mins,07-17-25,English,4.9    55 ratings,14.67,Computers & Technology,Computer Science
"AI: Unexplainable, Unpredictable, Uncontrollable",Roman V. Yampolskiy PhD,Paul Boehmer,8 hrs,04-28-26,English,Not rated yet,19.52,Computers & Technology,Computer Science
Co-Intelligence,Ethan Mollick,Ethan Mollick,4 hrs and 39 mins,04-02-24,English,4.5    983 ratings,15.75,Computers & Technology,Computer Science
AI-Powered Digital & Social Media Marketing 2026: Surpass 2025,Maxwell Cyberstein,Millian Quintero,6 hrs and 52 mins,09-29-25,English,4.7    9 ratings,17.58,Computers & Technology,Computer Science
Code Red,Wynton Hall,Jonathan Todd Ross,8 hrs and 20 mins,03-17-26,English,5.0    1 rating,23.39,Computers & Technology,Computer Science
AI Engineering,Chip Huyen,Edelyn Okano,21 hrs and 12 mins,06-17-25,English,4.4    47 ratings,32.20,Computers & Technology,Computer Science
"AI CHATGPT MARKETING FOR BUSINESS 2025 Step-by-Step Guide for Beginners: Learn to Make Money with AI Tools, Grow on Social Media, and Build a Strong Digital Presence to Drive Real Online Results.",Evan Crossfield,Millian Quinteros,9 hrs and 52 mins,07-22-25,English,5.0    50 ratings,20.35,Computers & Technology,Computer Science
The Thinking Machine,Stephen Witt,Stephen Witt,10 hrs and 17 mins,04-08-25,English,4.7    398 ratings,20.25,Computers & Technology,Computer Science
How to Think Clearly in the Age of AI: Stoic Wisdom for an Automated World,Austin Chen,Ted Kettler,4 hrs and 38 mins,02-26-26,English,5.0    41 ratings,15.75,Computers & Technology,Computer Science
La Guía Definitiva De La IA Generativa,Jordan Blake,Nicolas Villanueva,5 hrs and 26 mins,01-30-26,Spanish,5.0    11 ratings,15.38,Computers & Technology,Computer Science
Leaderwired,Anna Barnhill,Rachael Doolen,5 hrs and 43 mins,03-09-26,English,Not rated yet,16.87,Computers & Technology,Computer Science
AI Swing Trading Made Simple,Angel Talamantes,Jacob Baird,4 hrs and 29 mins,03-09-26,English,5.0    17 ratings,15.75,Computers & Technology,Computer Science
Super Agers,Eric Topol,Eric Topol,14 hrs and 43 mins,05-06-25,English,4.0    126 ratings,22.49,Computers & Technology,Computer Science
Unlocking the Code of Life,Jorik Malvern,BWC,3 hrs and 21 mins,01-26-26,English,5.0    71 ratings,14.28,Computers & Technology,Computer Science
SUPERALIGNMENT,Alex M. Vikoulov,Virtual Voice,5 hrs and 44 mins,02-23-26,English,5.0    1 rating,14.99,Computers & Technology,Computer Science
Agentic Artificial Intelligence,"Pascal Bornet, Jochen Wirtz, Thomas H. Davenport, David De Cremer, Brian Evergreen, Phil Fersht, Rakesh Gohel, Shail Khiyara, Nandan Mullakara, Pooja Sund",Rory Young,14 hrs and 42 mins,03-26-25,English,4.2    67 ratings,23.30,Computers & Technology,Computer Science
The Beginner's Guide to Terminal AI Agents (CLI),Tom Anderson,Virtual Voice,6 hrs and 23 mins,02-02-26,English,5.0    1 rating,Free,Computers & Technology,Computer Science
The Claude Code Weekend Projects,Jake Morrison,Virtual Voice,5 hrs and 58 mins,02-13-26,English,Not rated yet,Free,Computers & Technology,Computer Science
ChatGPT Stock Trading for Beginners,Angel Talamantes,Jacob Baird,3 hrs and 34 mins,03-13-26,English,5.0    5 ratings,14.28,Computers & Technology,Computer Science
AI Made Simple Collection,D. Nardo Publications,Scott Gillis,5 hrs and 35 mins,02-11-26,English,5.0    27 ratings,16.51,Computers & Technology,Computer Science
AI Stock Analysis for Smarter Trades,Angel Talamantes,John Wilkinson,4 hrs and 42 mins,02-26-26,English,4.8    38 ratings,15.75,Computers & Technology,Computer Science
Why Machines Learn,Anil Ananthaswamy,Rene Ruiz,13 hrs and 30 mins,07-16-24,English,4.3    49 ratings,20.25,Computers & Technology,Computer Science
Claude Code AI Subagents,Jake Morrison,Virtual Voice,3 hrs and 56 mins,02-14-26,English,4.5    2 ratings,12.99,Computers & Technology,Computer Science
AZ-900 for Busy People,Jason Edwards,Virtual Voice,14 hrs and 44 mins,01-29-26,English,5.0    1 rating,Free,Computers & Technology,Computer Science
The AI Leader's Playbook: AI for Business Strategy,Austin Chen,Ted Kettler,3 hrs and 27 mins,01-30-26,English,5.0    50 ratings,14.28,Computers & Technology,Computer Science
AI-Powered Affiliate Marketing 2026,Jason P Anderson,Tom Brooks,6 hrs and 39 mins,12-17-25,English,5.0    50 ratings,17.58,Computers & Technology,Computer Science
"YouTube Growth With AI: Use ChatGPT, Canva AI & Video Automation Tools to Grow Your Channel Faster: A Step-by-Step Guide to Writing YouTube Scripts, Titles, and Videos",Angel Talamantes,Jacob Baird,4 hrs and 4 mins,01-29-26,English,5.0    62 ratings,15.75,Computers & Technology,Computer Science
"The AI Business Blueprint: How to Make Money with AI, Build Passive Income, and Launch a Simple AI Side Hustle That Pays You On Repeat",Austin Chen,Tom Wilde,7 hrs and 41 mins,01-26-26,English,5.0    48 ratings,18.63,Computers & Technology,Computer Science
Make Money with AI 2‑in‑1,Austin Chen,"Jamal West, Tom Wilde",14 hrs and 31 mins,03-04-26,English,5.0    19 ratings,22.65,Computers & Technology,Computer Science
Algorithms to Live By,"Brian Christian, Tom Griffiths",Brian Christian,11 hrs and 50 mins,04-19-16,English,"4.4    17,479 ratings",21.00,Computers & Technology,Computer Science
Convierte a ChatGPT en una Dinero Máquina,Eric Mallon,Javier Cruz,5 hrs and 36 mins,11-20-25,Spanish,4.3    6 ratings,Free,Computers & Technology,Computer Science
Flash Teams,"Melissa Valentine, Michael Bernstein",Paul Bellantoni,6 hrs and 15 mins,02-17-26,English,Not rated yet,17.58,Computers & Technology,Computer Science
Human Again,J.D. Macpherson,Virtual Voice,6 hrs and 46 mins,02-02-26,English,Not rated yet,Free,Computers & Technology,Computer Science
Rising in the Age of AI,Jesus Kirk,Scott LeCote,1 hr and 19 mins,03-02-26,English,Not rated yet,11.18,Computers & Technology,Computer Science
Build a Business with ChatGPT (2025 Edition),Angel Talamantes,Jacob Baird,3 hrs and 39 mins,12-03-25,English,5.0    129 ratings,14.67,Computers & Technology,Computer Science
Claude Opus 4.6 for Beginners,Jake Morrison,Virtual Voice,4 hrs and 48 mins,02-17-26,English,Not rated yet,14.99,Computers & Technology,Computer Science
AI Prompt Engineering Made Easy: From Ideas to Business-Ready Outputs in Minutes,Rowan Treadwell,Rory Young,6 hrs and 38 mins,01-20-26,English,5.0    25 ratings,17.61,Computers & Technology,Computer Science
The AI-Enhanced Lawyer: AI Legal Strategy Without Sacrificing Standards,Austin Chen,Jamal West,5 hrs and 57 mins,02-26-26,English,5.0    34 ratings,16.87,Computers & Technology,Computer Science
The Infinity Machine,Sebastian Mallaby,Vidish Athavale,15 hrs and 6 mins,03-31-26,English,Not rated yet,19.14,Computers & Technology,Computer Science
Agentic System and Design,Ajit Singh,Virtual Voice,9 hrs and 11 mins,01-30-26,English,Not rated yet,Free,Computers & Technology,Computer Science
A Giant Leap,Robert Wachter,"Robert Wachter, Benjamin Wachter",9 hrs and 11 mins,02-03-26,English,4.8    13 ratings,19.80,Computers & Technology,Computer Science
Claude Code for Entrepreneurs,Michael Patterson,Louise Cooksey's voice replica,5 hrs and 59 mins,03-12-26,English,Not rated yet,Free,Computers & Technology,Computer Science
The Nvidia Way,Tae Kim,Michael Braun,9 hrs and 42 mins,12-10-24,English,4.7    513 ratings,20.35,Computers & Technology,Computer Science
BEYOND ChatGPT: Why Agentic AI Changes Everything,Dawn O'Neal,Virtual Voice,3 hrs and 18 mins,11-06-25,English,5.0    1 rating,14.95,Computers & Technology,Computer Science
Save the Creatives,Brandon Triola,Brandon J. Triola,5 hrs and 34 mins,12-19-25,English,4.0    2 ratings,16.87,Computers & Technology,Computer Science
Colección Definitiva de IA Generativa para Principiantes,Jordan Blake,Nicolas Villanueva,14 hrs and 55 mins,01-30-26,Spanish,5.0    14 ratings,19.54,Computers & Technology,Computer Science
Build Your First AI Personal Assistant with Claude Code,Jake Morrison,Virtual Voice,5 hrs and 10 mins,02-16-26,English,Not rated yet,14.99,Computers & Technology,Computer Science
Unfinished,Lucas Cantor Santiago,Christopher Ragland,7 hrs and 38 mins,12-11-25,English,5.0    1 rating,18.99,Computers & Technology,Computer Science
AI in Healthcare: A Science-Backed Guide to Stay Ahead in Your Career,V Soltis,Dana Lopez,2 hrs and 50 mins,12-15-25,English,5.0    43 ratings,12.59,Computers & Technology,Computer Science
"The Vibe-Coded SDLC: Evolution, Disruption, and What’s Next",Faisal Mushtaq,Virtual Voice,4 hrs and 33 mins,12-10-25,English,Not rated yet,Free,Computers & Technology,Computer Science
How AI Really Thinks,Julian Vexley,Michelle Peitz,2 hrs and 17 mins,12-19-25,English,5.0    100 ratings,13.06,Computers & Technology,Computer Science
Prompting Makes Perfect,Mike Reuben,Ryan Forkel,2 hrs and 16 mins,02-24-26,English,5.0    4 ratings,Free,Computers & Technology,Computer Science
The AI Deadline,Austin Chen,Ted Kettler,4 hrs and 33 mins,03-19-26,English,5.0    3 ratings,14.95,Computers & Technology,Computer Science
ChatGPT Income Empire,Charlie Wineberg,Tom Brooks,6 hrs and 30 mins,12-04-25,English,5.0    27 ratings,17.58,Computers & Technology,Computer Science
"Trader's Toolkit: 3 Audiobooks in 1 — Master Day Trading, AI Trading, and Options Trading to Build Wealth and Trade Smarter",Angel Talamantes,Angel Talamantes,11 hrs and 15 mins,01-02-26,English,5.0    102 ratings,20.82,Computers & Technology,Computer Science
72 Claude Code Tips for Beginners,Tom Anderson,Virtual Voice,6 hrs and 56 mins,02-10-26,English,Not rated yet,Free,Computers & Technology,Computer Science
ChatGPT for Content Creation,Angel Talamantes,Jacob Baird,3 hrs and 52 mins,12-22-25,English,5.0    143 ratings,14.28,Computers & Technology,Computer Science
Multi-Agent AI Systems,Tom Anderson,Virtual Voice,7 hrs and 21 mins,01-30-26,English,Not rated yet,Free,Computers & Technology,Computer Science
AI Snake Oil,"Sayash Kapoor, Arvind Narayanan",Landon Woodson,10 hrs and 31 mins,09-24-24,English,4.3    112 ratings,21.24,Computers & Technology,Computer Science
Get Insanely Good at AI,Ebenezer Don,Virtual Voice,5 hrs and 4 mins,03-26-26,English,Not rated yet,14.99,Computers & Technology,Computer Science
Soul. Fiction. Film.,Harvey Castro MD,Virtual Voice,10 hrs and 23 mins,03-26-26,English,Not rated yet,14.95,Computers & Technology,Computer Science
ChatGPT for Excel Beginners,Angel Talamantes,Susan Prater,4 hrs and 6 mins,03-26-26,English,Not rated yet,14.95,Computers & Technology,Computer Science
The Quantum Internet,Ajit Singh,Virtual Voice,9 hrs and 14 mins,03-25-26,English,Not rated yet,Free,Computers & Technology,Computer Science
Claude Code for Beginners,J Cook,Virtual Voice,4 hrs and 56 mins,03-25-26,English,Not rated yet,Free,Computers & Technology,Computer Science
The Quantum Internet of Things,Ajit Singh,Virtual Voice,9 hrs and 56 mins,03-25-26,English,Not rated yet,Free,Computers & Technology,Computer Science
AR and VR Technology Explained,Johnny Nelson,Roy Bunales,1 hr and 21 mins,03-25-26,English,Not rated yet,Free,Computers & Technology,Computer Science
AI from Simple Beginnings to Creative Prompts,Dawn ONeal,Scott LeCote,8 hrs and 56 mins,10-27-25,English,5.0    23 ratings,19.52,Computers & Technology,Computer Science
AI Agent Side Hustle,Austin Chen,Jay Ball,5 hrs and 8 mins,03-19-26,English,5.0    3 ratings,16.51,Computers & Technology,Computer Science
AI-Built Digital Empire,Deborah Beckwith,Jake Andrews,1 hr and 14 mins,01-28-26,English,Not rated yet,10.18,Computers & Technology,Computer Science
Claude Code on Your Phone,Tom Anderson,Virtual Voice,4 hrs and 29 mins,02-19-26,English,Not rated yet,12.99,Computers & Technology,Computer Science
The Means of Prediction,Maximilian Kasy,John Chancer,7 hrs and 43 mins,02-03-26,English,Not rated yet,18.63,Computers & Technology,Computer Science
"2084 and the AI Revolution, Updated and Expanded Edition",John C. Lennox,John C. Lennox,17 hrs,11-26-24,English,4.7    63 ratings,35.99,Computers & Technology,Computer Science
Build Anything with AI,Tom Anderson,Virtual Voice,6 hrs and 59 mins,02-03-26,English,Not rated yet,Free,Computers & Technology,Computer Science
Non-Computable You,Robert J. Marks,Larry Nobles,13 hrs and 3 mins,09-07-22,English,4.3    7 ratings,22.66,Computers & Technology,Computer Science
Nexus [Nexus: A Brief History of Information Networks from the Stone Age to AI],"Yuval Noah Harari, Joandomènec Ros i Aragonès",Luis David García Márquez,17 hrs and 50 mins,09-10-24,Spanish,4.6    437 ratings,21.59,Computers & Technology,Computer Science
AI Next Step Prompt Engineering,Dawn O'Neal,Scott LeCote,4 hrs and 8 mins,07-21-25,English,5.0    24 ratings,15.75,Computers & Technology,Computer Science
AI Made Simple for Beginners,Dawn O'Neal,Scott LeCote,4 hrs and 50 mins,01-29-25,English,5.0    38 ratings,15.75,Computers & Technology,Computer Science
Leading AI Adoption in Healthcare,MELINDA DEHOLL,Melinda deHoll,2 hrs and 26 mins,02-27-26,English,Not rated yet,13.20,Computers & Technology,Computer Science
2026 COPILOT,Sam Zuker,Sarah Sun Park,2 hrs and 57 mins,03-12-26,English,Not rated yet,13.06,Computers & Technology,Computer Science
"Building LLMs from Scratch: Designing, Training, Evaluating, and Deploying a Large Language Models",Practicing Engineers Network,Virtual Voice,6 hrs and 45 mins,01-06-26,English,Not rated yet,Free,Computers & Technology,Computer Science
ChatGPT And the Future of AI,Terrence J. Sejnowski,Randy McCarten,7 hrs and 18 mins,01-10-25,English,3.6    8 ratings,18.63,Computers & Technology,Computer Science
"Building AI Agents: Platforms, Frameworks, and Real-World Implementations",Practicing Engineers Network,Virtual Voice,2 hrs and 16 mins,12-16-25,English,Not rated yet,Free,Computers & Technology,Computer Science
Serious Managers Guide to AI and FHIR,Claude Louis-Charles,Virtual Voice,4 hrs and 57 mins,03-24-26,English,Not rated yet,Free,Computers & Technology,Computer Science
"The Complete Artificial Intelligence Collection (8 in 1): Machine Learning, ChatGPT, AI Agents, Prompt Engineering, Automation, the Future of Work, and How to Transform Your Business and Career",Kai Westin,Virtual Voice,46 hrs and 50 mins,03-24-26,English,Not rated yet,14.99,Computers & Technology,Computer Science
Learn AI or Get Fired,S.K.,Virtual Voice,5 hrs and 49 mins,03-23-26,English,Not rated yet,Free,Computers & Technology,Computer Science
"Design, Build & Deploy AI-Powered Full Stack Apps",Ajit Singh,Virtual Voice,9 hrs and 56 mins,03-24-26,English,Not rated yet,Free,Computers & Technology,Computer Science
AI Agents for Normal People,Tom Anderson,Jon Mills's voice replica,3 hrs and 18 mins,03-24-26,English,Not rated yet,14.95,Computers & Technology,Computer Science
Echos in the Code,Harvey Castro MD,Virtual Voice,10 hrs and 42 mins,03-23-26,English,Not rated yet,14.99,Computers & Technology,Computer Science
The Benefits and Risks of GM Food,Jonathan Clark,Virtual Voice,16 mins,03-23-26,English,Not rated yet,Free,Computers & Technology,Computer Science
Astrology and AI to Amplify Your Life,Jonathan Smith,Devin Miller's voice replica,3 hrs and 31 mins,03-23-26,English,Not rated yet,14.95,Computers & Technology,Computer Science
Hacking the Informational Multiverse,Clayton Louis Turnage,Virtual Voice,1 hr and 6 mins,03-23-26,English,Not rated yet,Free,Computers & Technology,Computer Science
The AI Certificates You Need to Upskill,Sarah Chen,Jon Mills's voice replica,2 hrs and 54 mins,03-23-26,English,Not rated yet,Free,Computers & Technology,Computer Science
101 Real Tasks That GPT-5 Can Actually Do,Andrew Rosso,Virtual Voice,3 hrs and 47 mins,03-22-26,English,Not rated yet,12.99,Computers & Technology,Computer Science
"82 Non-Coder Automations with ChatGPT, Zapier, and n8n",Brandon Mitchell,Virtual Voice,3 hrs and 24 mins,03-22-26,English,Not rated yet,12.99,Computers & Technology,Computer Science
101 Ready to Use AI Prompts for Lawyers,Brandon Mitchell,Josiah John Bildner's voice replica,3 hrs and 38 mins,03-23-26,English,Not rated yet,14.95,Computers & Technology,Computer Science
101 AI Tools and Prompts for Podcasters and Creators,Brandon Mitchell,Jon Mills's voice replica,4 hrs and 34 mins,03-23-26,English,Not rated yet,14.95,Computers & Technology,Computer Science
The AI Layoff Survival Guide,Sarah Chen,Elizabeth Ruelas's voice replica,3 hrs and 29 mins,03-23-26,English,Not rated yet,14.95,Computers & Technology,Computer Science
DEEPSEEK 2026,Sam Zuker,Shannon Boyd,1 hr and 54 mins,03-23-26,English,Not rated yet,Free,Computers & Technology,Computer Science
Artificial Intelligence in Everyday Life and Work,Susan Clare Britton,Timothy Burke,1 hr and 21 mins,03-23-26,English,Not rated yet,Free,Computers & Technology,Computer Science
"When AI Can Do Everything, What Value Do You Still Bring?: Why Judgment Still Matters in the Age of AI",Ethan Cole,Deborah R. Brown,2 hrs and 31 mins,03-23-26,English,Not rated yet,Free,Computers & Technology,Computer Science
101 AI Tools and Prompts for Fitness Trainers,Brandon Mitchell,Paul Stefano's voice replica,3 hrs and 37 mins,03-24-26,English,Not rated yet,14.95,Computers & Technology,Computer Science
The Cosmic Hard Drive Hypothesis,Clayton Louis Turnage,Virtual Voice,1 hr and 39 mins,03-23-26,English,Not rated yet,Free,Computers & Technology,Computer Science
I Am Not a Robot,Joanna Stern,Joanna Stern,8 hrs and 2 mins,05-12-26,English,Not rated yet,25.19,Computers & Technology,Computer Science
AI for Small Business Owners,Angel Talamantes,John Wilkinson,5 hrs and 34 mins,01-29-26,English,5.0    64 ratings,16.51,Computers & Technology,Computer Science
72 Claude Code Custom Commands,Michael Patterson,Ed Fairbanks's voice replica,4 hrs and 29 mins,03-12-26,English,Not rated yet,Free,Computers & Technology,Computer Science
Coexisting with AI,Kay Firth-Butterfield,Tracy Parsons,7 hrs and 52 mins,01-13-26,English,Not rated yet,18.63,Computers & Technology,Computer Science
AI + n8n: Smart Workflows for the Future,Rajamanickam Antonimuthu,Virtual Voice,2 hrs and 1 min,11-14-25,English,Not rated yet,Free,Computers & Technology,Computer Science
Red Dead's History,Tore C. Olsson,Roger Clark,10 hrs and 28 mins,08-06-24,English,4.5    312 ratings,20.24,Computers & Technology,Computer Science
101 Ready to Use AI Prompts for Every Business Situation,Brandon Mitchell,Jon Mills's voice replica,4 hrs and 6 mins,03-18-26,English,Not rated yet,Free,Computers & Technology,Computer Science
The Instant AI Agency,Dan Wardrope,Om Beacom-Halliday,3 hrs and 7 mins,08-30-24,English,3.8    90 ratings,14.67,Computers & Technology,Computer Science
El estilo de vida ChatGPT,Alex Bennett,Gustavo Gómez,4 hrs and 31 mins,09-16-25,Spanish,5.0    34 ratings,14.78,Computers & Technology,Computer Science
Some Future Day,Marc Beckman,Nicholas Kilowaski,8 hrs and 18 mins,03-20-25,English,4.1    9 ratings,19.52,Computers & Technology,Computer Science
The AI Prompt Engineering Principles,Pierce Caldwell,Virtual Voice,5 hrs and 29 mins,12-30-25,English,Not rated yet,Free,Computers & Technology,Computer Science
ChatGPT Side Hustles 2026,Daniel Brooks,David Throne,4 hrs and 27 mins,03-23-26,English,Not rated yet,14.95,Computers & Technology,Computer Science
The AI Leverage Playbook,Brad Cavalier,Myriam Berger,1 hr and 17 mins,03-09-26,English,Not rated yet,11.18,Computers & Technology,Computer Science
52 Claude Code Skills & Hooks You Should Know,Jake Morrison,Virtual Voice,6 hrs and 1 min,02-13-26,English,Not rated yet,14.99,Computers & Technology,Computer Science
ChatGPT Side Hustle,Austin Chen,Jamal West,3 hrs and 50 mins,11-12-25,English,5.0    73 ratings,14.28,Computers & Technology,Computer Science
"AI Side Hustles for Beginners: Make Passive Income Online with ChatGPT, Midjourney, and AI Automation: Discover Proven Methods to Build Online Income",Angel Talamantes,Jacob Baird,3 hrs and 47 mins,01-05-26,English,5.0    116 ratings,14.28,Computers & Technology,Computer Science
The Artificial Intelligence and Generative AI Bible,Alger Fraley,Ralph Mitchell,5 hrs and 31 mins,02-01-24,English,3.9    38 ratings,16.51,Computers & Technology,Computer Science
AI for Product Managers,Valerio Zanini,Virtual Voice,8 hrs and 44 mins,11-26-25,English,5.0    2 ratings,Free,Computers & Technology,Computer Science
Decoding Reality,Vlatko Vedral,Jay Russell,9 hrs and 11 mins,04-06-10,English,4.0    182 ratings,20.88,Computers & Technology,Computer Science
Top 100 Next-Generation AI Tools of 2026,Practicing Engineers Network,Virtual Voice,1 hr and 59 mins,02-03-26,English,Not rated yet,Free,Computers & Technology,Computer Science
Cybersecurity Myths and Misconceptions,"Eugene H. Spafford, Leigh Metcalf, Josiah Dykstra",Rich Boniface,15 hrs and 8 mins,04-26-24,English,4.9    7 ratings,23.63,Computers & Technology,Computer Science
